{
  "kind": "halbach_array_config",
  "version": "1.0",
  "units": {
    "length": "mm",
    "angle": "deg"
  },
  "geometry": {
    "inner_radius": 25.0,
    "outer_radius": 50.0,
    "axial_length": 100.0,
    "segment_count": 16,
    "segment_gap_angle": 0.0,
    "segment_start_angle": 0.0
  },
  "array": {
    "field_mode": "internal",
    "multipole_order": 1,
    "field_direction": 0.0
  },
  "magnet": {
    "source": "catalog",
    "grade": "N42",
    "temperature_c": 20.0
  },
  "sample_region": {
    "radius": 20.0,
    "radial_samples": 31,
    "angular_samples": 96,
    "leakage_probe_radius": 75.0
  },
  "solve": {
    "quality": "standard",
    "mesh": {
      "density": "normal",
      "outer_boundary_radius_factor": 4.0,
      "minimum_elements_across_magnet": 6,
      "corner_refinement": true
    },
    "linear": {
      "solver": "direct",
      "pcg_preconditioner": "incomplete_cholesky",
      "tolerance": 1e-8,
      "max_iterations": 5000
    },
    "field_line_count": 18
  }
}
